{
  "schemaVersion": "1.0.0",
  "id": "web-saas",
  "version": "1.2.0",
  "name": "Next.js SaaS assurance pack",
  "limitations": [
    "This pack measures only the documented static patterns and named runtime evidence requirements.",
    "A clean result does not certify framework security, authorization, tenant isolation, or payment correctness.",
    "Row-level security, cache isolation, webhook replay resistance, and deployed configuration require runtime evidence."
  ],
  "stacks": [
    {
      "id": "nextjs",
      "packages": ["next"],
      "markers": ["next.config.js", "next.config.mjs", "next.config.ts"],
      "versionVariants": [
        "pages-router",
        "app-router-v13",
        "app-router-v14-plus"
      ]
    },
    {
      "id": "supabase",
      "packages": ["@supabase/supabase-js", "@supabase/ssr"],
      "markers": ["supabase/config.toml"],
      "versionVariants": ["supabase-js-v1", "supabase-js-v2", "ssr"]
    },
    {
      "id": "prisma",
      "packages": ["@prisma/client", "prisma"],
      "markers": ["prisma/schema.prisma"],
      "versionVariants": ["prisma-v4", "prisma-v5-plus"]
    },
    {
      "id": "drizzle",
      "packages": ["drizzle-orm", "drizzle-kit"],
      "markers": ["drizzle.config.js", "drizzle.config.ts"],
      "versionVariants": ["drizzle-v0"]
    },
    {
      "id": "stripe",
      "packages": ["stripe"],
      "markers": [],
      "versionVariants": ["stripe-node-v12", "stripe-node-v13-plus"]
    }
  ],
  "checks": [
    {
      "id": "client-public-secret",
      "version": "1.0.0",
      "stacks": ["nextjs", "stripe"],
      "evidenceClass": "deterministic",
      "semgrepRuleId": "public-env-holds-secret",
      "ruleFile": ".semgrep/vibe-moat-rules.yaml",
      "summary": "Client-exposed environment prefixes must not carry secret-like values.",
      "insecureExample": "process.env.NEXT_PUBLIC_STRIPE_SECRET_KEY",
      "safePattern": "Read STRIPE_SECRET_KEY only in server code.",
      "verification": "Inspect the built client bundle and confirm the secret value is absent.",
      "limitations": [
        "Name-based detection cannot identify a secret with a benign variable name."
      ],
      "assuranceMappings": [
        {
          "standard": "OWASP ASVS",
          "control": "V14.2.3",
          "confidence": "high",
          "limitation": "Detects only recognized public prefixes and secret-like names."
        }
      ]
    },
    {
      "id": "next-client-privileged-client",
      "version": "1.0.0",
      "stacks": ["nextjs", "supabase"],
      "stackMatch": "all",
      "evidenceClass": "deterministic",
      "semgrepRuleId": "service-key-in-client-component",
      "ruleFile": ".semgrep/vibe-moat-rules.yaml",
      "summary": "Privileged service clients must not be constructed in a client component.",
      "insecureExample": "'use client'; createClient(url, process.env.SUPABASE_SERVICE_ROLE_KEY)",
      "safePattern": "Construct privileged clients in a server-only module or route.",
      "verification": "Build the app and inspect client chunks for the privileged credential.",
      "limitations": [
        "Aliased constructors or credentials hidden behind helper calls may not match."
      ],
      "assuranceMappings": [
        {
          "standard": "OWASP ASVS",
          "control": "V14.2.3",
          "confidence": "high",
          "limitation": "Static source match does not inspect the emitted bundle."
        }
      ]
    },
    {
      "id": "next-route-auth",
      "version": "1.0.0",
      "stacks": ["nextjs"],
      "evidenceClass": "heuristic",
      "semgrepRuleId": "next-route-handler-missing-auth",
      "ruleFile": ".semgrep/vibe-moat-rules.yaml",
      "summary": "Mutation route handlers should show an authorization decision.",
      "insecureExample": "export async function POST(req) { return db.user.delete(...) }",
      "safePattern": "Resolve and validate the caller session before the mutation.",
      "verification": "Exercise the route unauthenticated and as a second user; both must be denied.",
      "limitations": [
        "Project-specific auth wrappers and intentionally public routes require review."
      ],
      "assuranceMappings": [
        {
          "standard": "OWASP ASVS",
          "control": "V4.1.1",
          "confidence": "medium",
          "limitation": "Auth may be enforced by middleware or an unrecognized wrapper."
        }
      ]
    },
    {
      "id": "next-untrusted-redirect",
      "version": "1.0.0",
      "stacks": ["nextjs"],
      "evidenceClass": "deterministic",
      "semgrepRuleId": "next-untrusted-redirect",
      "ruleFile": ".semgrep/vibe-moat-rules.yaml",
      "summary": "Redirect destinations must not come directly from request input.",
      "insecureExample": "redirect(req.nextUrl.searchParams.get('next'))",
      "safePattern": "Map an allowlisted destination key to a local path.",
      "verification": "Supply an external URL and confirm the response cannot redirect off-site.",
      "limitations": [
        "Data-flow through helper functions may not be detected."
      ],
      "assuranceMappings": [
        {
          "standard": "OWASP ASVS",
          "control": "V5.1.5",
          "confidence": "high",
          "limitation": "Covers direct request-to-redirect flows only."
        }
      ]
    },
    {
      "id": "next-auth-cache-isolation",
      "version": "1.0.0",
      "stacks": ["nextjs"],
      "evidenceClass": "runtime",
      "semgrepRuleId": null,
      "ruleFile": null,
      "summary": "Authenticated and tenant data must not cross cache keys or revalidation boundaries.",
      "insecureExample": "Cache a tenant query under one global key.",
      "safePattern": "Include authorization scope in the cache key or opt sensitive reads out of shared caching.",
      "verification": "Probe the same cached route as two users and two tenants after revalidation.",
      "limitations": [
        "Cache isolation cannot be established from source syntax alone."
      ],
      "assuranceMappings": [
        {
          "standard": "OWASP ASVS",
          "control": "V8.3.4",
          "confidence": "low",
          "limitation": "Requires deployed two-user runtime evidence."
        }
      ]
    },
    {
      "id": "supabase-privileged-client",
      "version": "1.0.0",
      "stacks": ["supabase"],
      "evidenceClass": "heuristic",
      "semgrepRuleId": "supabase-service-role-client",
      "ruleFile": ".semgrep/vibe-moat-rules.yaml",
      "summary": "Service-role clients require an explicit server-only trust boundary.",
      "insecureExample": "createClient(url, process.env.SUPABASE_SERVICE_ROLE_KEY)",
      "safePattern": "Isolate the service-role client in a server-only admin module with caller checks.",
      "verification": "Trace every caller and confirm no untrusted request can select arbitrary rows.",
      "limitations": [
        "A privileged client can be valid; this rule identifies a mandatory review point."
      ],
      "assuranceMappings": [
        {
          "standard": "OWASP ASVS",
          "control": "V4.2.1",
          "confidence": "medium",
          "limitation": "Static construction alone cannot prove authorization is missing."
        }
      ]
    },
    {
      "id": "supabase-cross-tenant-read",
      "version": "1.0.0",
      "stacks": ["supabase"],
      "evidenceClass": "heuristic",
      "semgrepRuleId": "supabase-select-on-user-table",
      "ruleFile": ".semgrep/vibe-moat-rules.yaml",
      "summary": "Request-selected rows depend on verified RLS or explicit ownership scope.",
      "insecureExample": "supabase.from('users').select('*').eq('id', req.query.id)",
      "safePattern": "Use authenticated-user scope and verified RLS policies.",
      "verification": "Read the row as a second user and confirm the database denies it.",
      "limitations": ["Static analysis cannot inspect deployed RLS policies."],
      "assuranceMappings": [
        {
          "standard": "OWASP ASVS",
          "control": "V4.2.1",
          "confidence": "medium",
          "limitation": "A finding may be protected by deployed RLS."
        }
      ]
    },
    {
      "id": "supabase-rls-isolation",
      "version": "1.0.0",
      "stacks": ["supabase"],
      "evidenceClass": "runtime",
      "semgrepRuleId": null,
      "ruleFile": null,
      "summary": "RLS must deny cross-user reads and writes for every exposed table.",
      "insecureExample": "An authenticated user can select or update another user's row.",
      "safePattern": "Enable RLS and define least-privilege owner or tenant policies.",
      "verification": "Run two-user read and mutation probes against the deployed database.",
      "limitations": [
        "Local source files do not prove the policies deployed to the target database."
      ],
      "assuranceMappings": [
        {
          "standard": "OWASP ASVS",
          "control": "V4.2.1",
          "confidence": "low",
          "limitation": "Requires target-environment database evidence."
        }
      ]
    },
    {
      "id": "prisma-tenant-scope",
      "version": "1.0.0",
      "stacks": ["prisma"],
      "evidenceClass": "heuristic",
      "semgrepRuleId": "prisma-find-by-request-id-unscoped",
      "ruleFile": ".semgrep/vibe-moat-rules.yaml",
      "summary": "Prisma reads and mutations selected by request ID should include owner or tenant scope.",
      "insecureExample": "prisma.order.findUnique({ where: { id: req.params.id } })",
      "safePattern": "Include userId, ownerId, tenantId, organizationId, or accountId in the query.",
      "verification": "Attempt the operation using another user's object ID.",
      "limitations": [
        "Authorization enforced before the query may make a finding safe."
      ],
      "assuranceMappings": [
        {
          "standard": "OWASP ASVS",
          "control": "V4.2.1",
          "confidence": "medium",